{
  "resource_id": "https://example-resource.invalid/api",
  "display_name": "Example Resource API",
  "status": "draft",
  "owner": {
    "team": "example-owner",
    "contact": null
  },
  "scopes": [
    "example-project:records:read",
    "example-project:records:write"
  ],
  "audience_policy": "exact_single_resource",
  "protected_resource_metadata_url": "https://example-resource.invalid/.well-known/oauth-protected-resource/api",
  "entitlement_binding": {
    "type": "legacy_tool",
    "legacy_tool_slug": "example-project"
  },
  "created_at": "2026-08-25T00:00:00Z",
  "updated_at": "2026-08-25T00:00:00Z"
}
